{
  "schema": "l9.observation",
  "schemaVersion": "1.0.0",
  "observationId": "obs_revision_substitution",
  "producer": {
    "id": "l9-ci-sdk",
    "version": "2.0.0",
    "repository": "Quantum-L9/l9-ci-sdk"
  },
  "subject": {
    "kind": "git-revision",
    "repository": {
      "host": "github.com",
      "owner": "Quantum-L9",
      "name": "example"
    },
    "revision": {
      "commit": "bbbbbbbbbbbbbbbbbbbbbbbbbbbbbbbbbbbbbbbb"
    }
  },
  "check": {
    "id": "l9.tests",
    "version": "1.0.0",
    "configurationDigest": {
      "algorithm": "sha256",
      "value": "0000000000000000000000000000000000000000000000000000000000000000"
    }
  },
  "execution": {
    "runId": "run_fixture",
    "attempt": 1,
    "status": "passed",
    "startedAt": "2026-07-21T00:00:00.000Z",
    "completedAt": "2026-07-21T00:00:01.000Z"
  },
  "summary": {
    "findingCount": 0,
    "errorCount": 0,
    "warningCount": 0,
    "informationalCount": 0
  },
  "findings": [],
  "artifacts": []
}
